{
  "$schema": "https://raw.githubusercontent.com/bauer-group/CS-MinIO/main/init.schema.json",
  "buckets": [
    {
      "name": "documents",
      "region": "eu-central-1",
      "versioning": true,
      "quota": { "type": "hard", "size": "10GB" },
      "policy": "private"
    },
    {
      "name": "backups",
      "region": "eu-central-1",
      "versioning": true,
      "object_lock": true,
      "retention": { "mode": "compliance", "days": 365 },
      "lifecycle_rules": [
        { "prefix": "last/", "expire_days": 2 },
        { "prefix": "daily/", "expire_days": 15 },
        { "prefix": "weekly/", "expire_days": 36 },
        { "prefix": "monthly/", "expire_days": 186 }
      ],
      "policy": "private"
    },
    {
      "name": "public-assets",
      "region": "eu-central-1",
      "policy": "public",
      "cors": [
        {
          "allowed_origins": ["https://app.example.com"],
          "allowed_methods": ["GET", "HEAD"],
          "allowed_headers": ["*"],
          "expose_headers": ["ETag", "Content-Length"],
          "max_age_seconds": 3600
        }
      ]
    },
    {
      "name": "uploads",
      "region": "eu-central-1",
      "versioning": true,
      "quota": { "type": "hard", "size": "50GB" },
      "policy": "private",
      "cors": [
        {
          "allowed_origins": ["https://app.example.com"],
          "allowed_methods": ["GET", "PUT", "POST", "HEAD"],
          "allowed_headers": ["*"],
          "expose_headers": ["ETag"],
          "max_age_seconds": 3600
        }
      ]
    }
  ],
  "policies": [
    {
      "name": "pDocumentsReadWrite",
      "statements": [
        {
          "Effect": "Allow",
          "Action": [
            "s3:GetObject",
            "s3:PutObject",
            "s3:DeleteObject",
            "s3:ListBucket",
            "s3:GetBucketLocation",
            "s3:ListMultipartUploadParts",
            "s3:AbortMultipartUpload"
          ],
          "Resource": [
            "arn:aws:s3:::documents",
            "arn:aws:s3:::documents/*"
          ]
        }
      ]
    },
    {
      "name": "pBackupsWriteOnly",
      "statements": [
        {
          "Effect": "Allow",
          "Action": [
            "s3:PutObject",
            "s3:GetBucketLocation",
            "s3:ListMultipartUploadParts",
            "s3:AbortMultipartUpload"
          ],
          "Resource": [
            "arn:aws:s3:::backups",
            "arn:aws:s3:::backups/*"
          ]
        }
      ]
    },
    {
      "name": "pPublicAssetsReadWrite",
      "statements": [
        {
          "Effect": "Allow",
          "Action": [
            "s3:GetObject",
            "s3:PutObject",
            "s3:DeleteObject",
            "s3:ListBucket",
            "s3:GetBucketLocation",
            "s3:ListMultipartUploadParts",
            "s3:AbortMultipartUpload"
          ],
          "Resource": [
            "arn:aws:s3:::public-assets",
            "arn:aws:s3:::public-assets/*"
          ]
        }
      ]
    },
    {
      "name": "pUploadsReadWrite",
      "statements": [
        {
          "Effect": "Allow",
          "Action": [
            "s3:GetObject",
            "s3:PutObject",
            "s3:DeleteObject",
            "s3:ListBucket",
            "s3:GetBucketLocation",
            "s3:ListMultipartUploadParts",
            "s3:AbortMultipartUpload",
            "s3:ListBucketMultipartUploads"
          ],
          "Resource": [
            "arn:aws:s3:::uploads",
            "arn:aws:s3:::uploads/*"
          ]
        }
      ]
    }
  ],
  "groups": [
    {
      "name": "gApplications",
      "policies": ["pDocumentsReadWrite", "pPublicAssetsReadWrite", "pUploadsReadWrite"]
    },
    {
      "name": "gBackupAgents",
      "policies": ["pBackupsWriteOnly"]
    }
  ],
  "users": [
    {
      "access_key": "${APP_USER}",
      "secret_key": "${APP_PASSWORD}",
      "groups": ["gApplications"]
    },
    {
      "access_key": "${BACKUP_USER}",
      "secret_key": "${BACKUP_PASSWORD}",
      "groups": ["gBackupAgents"]
    }
  ],
  "service_accounts": [
    {
      "user": "${APP_USER}",
      "name": "app-worker",
      "description": "Worker service account for document processing"
    },
    {
      "user": "${BACKUP_USER}",
      "name": "backup-agent",
      "description": "Automated backup agent",
      "policy": "pBackupsWriteOnly"
    }
  ],
  "notifications": [
    {
      "id": "cdnpurge",
      "type": "webhook",
      "endpoint": "http://minio-worker:8080/webhook",
      "auth_token": "${WEBHOOK_AUTH_TOKEN}",
      "queue_dir": "/data/.minio-events",
      "queue_limit": 100000,
      "buckets": ["public-assets"],
      "events": ["put", "delete"],
      "prefix": "",
      "suffix": ""
    }
  ]
}
